{
  "$schema": "https://json-schema.org/draft/2020-12/schema",
  "$id": "neuralmarket:contract:pilot_authorization:2.0",
  "type": "object",
  "required": [
    "authorization_version",
    "pilot_plan_hash",
    "source_manifest_hash",
    "split_manifest_hash",
    "acquisition_policy_hash",
    "maximum_spend_usd",
    "maximum_single_request_usd",
    "authorized_currency",
    "authorized_at",
    "expires_at",
    "authorized_by",
    "confirmation_phrase",
    "purchase_authorized",
    "authorization_hash"
  ],
  "properties": {
    "authorization_version": {
      "type": "string",
      "enum": ["1.0", "2.0", "pilot-authorization-v1"]
    },
    "pilot_plan_hash": {
      "type": "string"
    },
    "source_manifest_hash": {
      "type": "string"
    },
    "split_manifest_hash": {
      "type": "string"
    },
    "acquisition_policy_hash": {
      "type": "string"
    },
    "maximum_spend_usd": {
      "type": "string",
      "pattern": "^[0-9]+\\.[0-9]{2}$"
    },
    "maximum_single_request_usd": {
      "type": "string",
      "pattern": "^[0-9]+\\.[0-9]{2}$"
    },
    "authorized_currency": {
      "type": "string"
    },
    "authorized_at": {
      "type": "string"
    },
    "expires_at": {
      "type": "string"
    },
    "authorized_by": {
      "type": "string"
    },
    "confirmation_phrase": {
      "type": "string"
    },
    "purchase_authorized": {
      "type": "boolean"
    },
    "authorization_hash": {
      "type": "string"
    },
    "remaining_scope_hash": {
      "type": ["string", "null"]
    },
    "cost_evidence": {
      "type": ["object", "null"],
      "required": ["evidence_type", "evidence_sha256", "observed_at", "expires_at"],
      "properties": {
        "evidence_type": {"type": "string"},
        "evidence_sha256": {"type": "string"},
        "observed_at": {"type": "string"},
        "expires_at": {"type": "string"}
      }
    },
    "portal_evidence": {
      "type": ["object", "null"],
      "required": ["evidence_type", "evidence_sha256", "observed_at", "expires_at"],
      "properties": {
        "evidence_type": {"type": "string"},
        "evidence_sha256": {"type": "string"},
        "observed_at": {"type": "string"},
        "expires_at": {"type": "string"}
      }
    },
    "portal_source_evidence_sha256": {
      "type": ["string", "null"]
    }
  },
  "if": {
    "properties": {
      "authorization_version": {"const": "2.0"}
    }
  },
  "then": {
    "required": [
      "remaining_scope_hash",
      "cost_evidence",
      "portal_evidence",
      "portal_source_evidence_sha256"
    ]
  }
}
