{
  "authorization_version": "2.0",
  "pilot_plan_hash": "REPLACE_WITH_EXACT_PLAN_HASH",
  "source_manifest_hash": "REPLACE_WITH_EXACT_SOURCE_MANIFEST_HASH",
  "split_manifest_hash": "REPLACE_WITH_EXACT_SPLIT_MANIFEST_HASH",
  "acquisition_policy_hash": "REPLACE_WITH_EXACT_ACQUISITION_POLICY_HASH",
  "maximum_spend_usd": "5.00",
  "maximum_single_request_usd": "1.00",
  "authorized_currency": "USD",
  "authorized_at": "1970-01-01T00:00:00Z",
  "expires_at": "1970-01-01T00:00:00Z",
  "authorized_by": "REPLACE_WITH_NAME",
  "confirmation_phrase": "AUTHORIZE_NEURALMARKET_PILOT_PURCHASE",
  "purchase_authorized": false,
  "remaining_scope_hash": "REPLACE_WITH_EXACT_SCOPE_HASH",
  "cost_evidence": {
    "evidence_type": "cost_recheck",
    "evidence_sha256": "REPLACE_WITH_EXACT_COST_EVIDENCE_SHA256",
    "observed_at": "1970-01-01T00:00:00Z",
    "expires_at": "1970-01-01T00:00:00Z"
  },
  "portal_evidence": {
    "evidence_type": "portal_attestation",
    "evidence_sha256": "REPLACE_WITH_EXACT_PORTAL_EVIDENCE_SHA256",
    "observed_at": "1970-01-01T00:00:00Z",
    "expires_at": "1970-01-01T00:00:00Z"
  },
  "portal_source_evidence_sha256": "REPLACE_WITH_EXACT_PORTAL_SOURCE_EVIDENCE_SHA256",
  "authorization_hash": "REPLACE_WITH_EXACT_HASH"
}
